		2023-09-07	2023-10-20	2023-11-17	2023-12-14	2024-01-19	2024-02-15	2024-03-15	2024-04-19	2024-05-16	2024-05-22	2024-06-13	2024-07-18	2024-08-16	2024-09-20	2024-10-18	2024-11-14
roller shutter installation melbourne		-	-	80	25	18	18	-	33	13	12	14	14	14	9	10	12
warehouse roller shutters melbourne		4	4	3	4	6	6	6	6	5	4	3	2	2	7	3	8
industrial roller shutters melbourne		3	3	2	3	23	21	38	24	24	26	2	4	5	19	16	14
commercial roller shutters melbourne		7	7	3	9	15	14	17	36	23	21	11	12	10	17	11	18
gate installation melbourne		65	66	53	24	22	30	28	35	36	35	79	42	37	51	36	48
boom gates melbourne		39	40	45	53	67	13	6	6	8	11	6	4	5	16	4	11
gate repairs melbourne		14	15	18	19	23	25	20	21	19	18	12	8	8	8	9	7
rapid roller doors melbourne		-	74	-	8	8	7	7	8	8	6	4	3	3	3	3	5
industrial sliding gates melbourne		74	69	-	11	14	14	15	16	15	14	8	8	22	10	11	26
sectional doors melbourne		-	-	-	-	-	-	-	-	-	-	-	-	-	-	-	-
industrial roller shutters altona		-	30	-	2	3	2	2	3	3	3	3	1	1	1	1	2
industrial roller shutters somerton		-	-	-	6	9	1	1	3	1	1	1	1	1	1	2	2
industrial roller shutters campbellfield		27	23	14	5	6	5	7	8	5	4	2	3	4	1	2	3
industrial roller shutters derrimut		25	25	-	6	6	2	2	1	1	1	1	1	1	1	1	2
industrial roller shutters hoppers crossing		-	-	45	3	4	4	3	3	3	3	2	2	2	2	2	2
industrial roller shutters melton		-	-	26	9	5	1	2	3	2	3	3	2	3	2	8	4
industrial roller shutters sunshine		-	-	-	6	9	5	3	3	2	2	2	3	3	3	2	2
industrial roller shutters taylors lakes		-	-	26	1	1	3	2	2	1	3	2	1	2	2	1	1
industrial roller shutters werribee		28	21	21	2	2	2	2	2	1	1	1	1	1	1	2	3
industrial roller shutters epping		-	24	31	13	14	15	13	7	8	4	3	2	1	1	2	5
industrial roller shutters truganina		-	-	22	4	5	2	2	2	1	1	1	1	1	1	1	1
industrial roller shutters laverton		25	23	21	5	7	8	7	9	1	1	1	1	1	1	1	3
industrial roller shutters deer park		-	-	-	2	3	1	2	1	1	1	1	1	1	1	1	1
industrial roller shutters caroline springs		-	-	-	2	2	1	2	2	2	2	1	1	1	2	2	2
industrial roller shutters hillside		-	-	-	2	2	2	2	2	2	2	2	2	2	2	1	2
industrial roller shutters thomastown		-	-	14	5	8	9	4	4	4	4	1	1	2	1	1	2
industrial roller shutters coolaroo		-	33	51	1	1	1	1	1	1	1	1	1	1	1	2	2
industrial roller shutters tarneit		-	-	27	2	2	2	2	2	2	2	2	1	1	1	2	1
industrial roller shutters st albans		-	-	26	2	2	2	1	2	1	1	1	1	1	3	4	3
industrial roller shutters point cook		-	-	-	4	3	3	3	2	2	2	1	1	1	1	1	1