		2024-08-20	2024-09-20	2024-10-18	2024-11-14
diesel turbo aftermarket parts australia		93	12	14	16
ford turbo aftermarket parts		-	-	-	-
holden turbo aftermarket parts		-	-	-	-
hyundai turbo aftermarket parts		-	-	-	-
intercooler hose kits ford		20	17	17	22
intercooler hose kits holden		4	6	8	7
intercooler hose kits hyundai		1	1	1	1
intercooler hose kits kia		37	62	79	-
intercooler hose kits mazda		12	11	16	15
intercooler hose kits mercedes		-	22	21	16
intercooler hose kits mitsubishi		10	8	7	13
kia turbo aftermarket parts		-	-	-	-
mercedes turbo aftermarket parts		-	-	-	-
mitsubishi turbo aftermarket parts		-	-	-	-
nissan turbo aftermarket parts		-	-	-	-
performance intercoolers australia		-	-	-	-
toyota turbo aftermarket parts		-	-	-	-
turbocharger fastener kits australia		1	1	1	1
turbocharger gaskets kits australia		4	4	4	4
turbocharger oil supply lines australia		9	9	14	18