		2024-09-06	2024-10-09	2024-11-13
car detailing products australia		-	-	10
car polish for sale		-	-	2
bulk car detailing products for sale		48	-	7
car detailing supplies australia		-	-	14
bulk car detailing supplies for sale		57	20	8
car care products australia		-	39	5
bulk car care products for sale		-	6	5
car cleaning supplies australia		-	-	10
bulk car cleaning supplies for sale		56	23	5
car polish supplies australia		-	55	10
wheel cleaner supplies australia		61	19	2
bulk wheel cleaners for sale		-	-	1
bulk degreaser for sale		75	-	1
wholesale degreaser		-	-	1
truck wash supplies australia		-	-	40
bulk truck wash products for sale		36	38	36
truck cleaning supplies australia		98	-	10
bulk truck cleaning products for sale		49	23	24
boat cleaning products australia		-	-	2
bulk boat cleaning products for sale		-	45	1