		2022-05-11	2022-06-15	2022-07-05	2022-07-29	2022-08-09	2022-09-16	2022-10-13	2022-11-07	2022-11-22	2022-12-15	2023-01-19	2023-02-16	2023-03-16	2023-04-14	2023-05-17	2023-06-15	2023-07-21	2023-08-17	2023-09-15	2023-10-20	2023-11-17	2023-12-13	2024-01-19	2024-02-15	2024-03-15	2024-04-17	2024-05-16	2024-06-13	2024-07-18	2024-08-16	2024-09-20	2024-10-18	2024-11-14
best blue mountains tours		-	-	27	12	11	9	7	7	7	7	7	6	7	7	7	7	6	6	7	5	7	5	6	6	8	8	2	4	4	3	6	3	1
blue mountain sydney tours		-	-	26	13	16	12	10	9	8	8	6	5	6	6	8	6	5	4	4	4	6	5	4	6	4	9	2	3	3	3	5	4	2
blue mountains day tours		-	-	19	17	25	16	11	11	10	9	6	5	5	6	6	5	4	4	4	4	6	3	3	5	3	8	3	4	4	4	5	5	3
blue mountains day trip from sydney		-	-	30	21	23	23	25	17	18	17	14	11	10	15	15	12	7	6	9	6	4	4	6	6	7	14	4	4	4	4	5	5	3
blue mountains tour bus		-	-	17	11	12	8	6	5	5	7	4	5	5	5	6	6	7	6	7	7	5	5	5	6	7	6	5	6	5	4	7	4	3
blue mountains tours		-	-	33	12	11	10	7	8	7	5	5	5	6	6	5	6	6	6	7	3	5	3	4	4	3	8	3	2	2	2	3	3	3
blue mountains tours from sydney		-	-	18	13	13	13	10	11	8	8	5	4	4	4	3	4	3	3	3	4	5	4	3	4	2	7	2	2	3	3	3	2	2
blue mountains tours sydney		-	-	19	8	14	6	6	7	5	2	4	4	4	4	2	3	2	2	2	5	4	4	2	3	2	7	2	3	3	3	4	3	2
sydney blue mountains tours		-	-	17	9	9	8	8	8	4	3	5	4	4	4	4	4	4	2	4	4	6	6	3	4	3	7	2	2	2	2	4	2	2
tours to blue mountains from sydney		-	-	19	17	16	14	10	11	9	9	7	4	5	4	4	5	5	3	3	3	5	6	4	5	2	6	2	2	3	3	3	3	2
blue mountains bus tour		-	-	-	-	-	-	-	-	4	4	6	3	4	4	3	5	5	5	7	5	4	5	5	7	7	5	6	5	5	4	6	3	6
blue mountains bus tour from sydney		-	-	-	-	-	-	-	-	3	3	2	2	2	2	2	2	2	2	2	2	1	2	2	2	2	2	2	2	2	1	1	3	2
blue mountains day trip itinerary		-	-	-	-	-	-	-	-	26	22	25	24	20	21	20	23	22	24	24	22	24	27	26	16	21	19	16	18	16	23	10	8	12
blue mountains guided tour		-	-	-	-	-	-	-	-	10	10	9	9	8	9	10	6	6	4	5	5	5	5	5	5	4	9	10	2	2	7	4	2	2
blue mountains one day tour		-	-	-	-	-	-	-	-	28	12	19	20	16	22	26	27	25	22	14	8	8	4	5	4	6	8	4	4	6	6	4	4	3
blue mountains one day trip		-	-	-	-	-	-	-	-	39	30	39	33	26	32	38	44	38	38	37	18	19	22	14	23	21	13	9	22	14	45	13	12	8
blue mountains sightseeing bus		-	-	-	-	-	-	-	-	7	10	7	6	2	2	2	2	4	5	5	5	3	8	7	4	4	5	4	5	3	3	5	6	5
blue mountains sightseeing tour		-	-	-	-	-	-	-	-	14	13	9	9	6	7	8	6	4	4	5	5	7	6	6	6	4	10	4	4	4	5	5	3	2
blue mountains trip from sydney		-	-	-	-	-	-	-	-	11	7	4	4	4	5	4	6	4	3	2	5	6	6	3	3	2	4	2	2	2	2	2	2	2
bus trip to blue mountains		-	-	-	-	-	-	-	-	5	3	2	2	2	3	2	3	3	2	3	3	3	3	3	3	4	3	2	5	4	3	2	2	2